,Unnamed: 0,Insult,Comment,Sentiment
2004,2004,0,henry cisneros democrat u secretary of housing and urban development from 1993 to 1997 pleaded guilty to a misdemeanor charge of lying to the fbijames a traficant jr democrat member of house of representative from ohio expelled from congress after being convicted of corruption charge sentenced today to eight year in prison for accepting bribe and kickback john doug hay democrat member of kentucky state senate from 1980 to 1982 found guilty of mail fraud for submitting false campaign report stemming from an unsuccessful run for judge he wa sentenced to six month in prison to be followed by six month of home confinement and three year of probation xc2xa0xc2xa0henry j cianfrani democrat pennsylvania state senate from 1967 to 1976 convicted on federal charge of racketeering and mail fraud for padding his senate payroll sentenced to five year in federal prison david hall democrat governor of oklahoma from 1971 to 1975 indicted on extortion and conspiracy charge convicted and sentenced to three year in prisonjohn a celona democrat a former state senator wa charged with the three count of mail fraud federal prosecutor accused him of defrauding the state and collecting hundred of thousand of dollar from cv corp and others while serving in the legislature celona ha agreed to plead guilty to taking money from the cv pharmacy chain and other company that had interest in legislation under the deal celona agreed to cooperate with investigator he face up to five year in federal prison on each of the three count and a 250000 fine xc2xa0allan turner howe democrat u representative from utah from 1975 to 1977 arrested for soliciting a policewoman posing a a p rostitutejerry cosentino democrat illinois state treasurer pleaded guilty to bank fraud fined 5000 and sentenced to nine month home confinementjoseph waggonner jr democrat u representative from louisiana from 1961 to 19 79 arrested in washington dc for soliciting a policewoman posing a a p rostitute nnlafayette thomas democrat candidate for tennessee state house of representative in 1954 sheriff of davidson county from 1972 to 1990 indicted in federal court on 54 count of abusing his power a sheriff pleaded guilty to theft and mail fraud sentenced to five year in prisonmary rose oakar democrat u representative from ohio from 1977 to 1993 pleaded guilty to two misdemeanor charge of funneling 16000 through fake donorsdavid giles democrat candidate for u representative from washington in 1986 and 1990 convicted in june 2000 of child r apegary siplin democrat state senator florida found guilty of thirddegree grand theft of 5000 or more a felony and using service of employee for his candidacyedward mezvinsky democrat u representative from iowa from 1973 to 1977 indicted on 56 federal fraud chargesxc2xa0lena swanson democrat member of washington state senate in 1997 pleaded guilty to charge of soliciting unlawful payment from veteran and former prisoner of warabraham j hirschfeld democrat candidate in democratic primary for u senator from new york in 1974 and 1976 offered paula jones 1 million to drop her s exual harassment lawsuit against president bill clinton convicted in 2000 of trying to hire a hit man to k ill his business partner nnfrank thompson jr democrat u representative from new jersey from 1955 to 1980 implicated in the abscam sting convicted on bribery and conspiracy charge sentenced to three year in prisonmichael joseph myers democrat u representative from pennsylvania from 1976 to 1980 xc2xa0alcee lamar hastings democrat u representative from florida impeached and removed from office a federal judge in 1989 over bribery chargesxe2x80xa6marion barry democrat mayor of washington dc from 1979 to 1991 and again from 1995 to 1999 convicted of cocaine possession after being caught on videotape smoking crack cocaine sentenced to six month in prisonxe2x80xa6mario biaggi democrat u representative from new york from 1969 to 1988 indicted on federal charge that he had accepted bribe in return for influence on federal contractsconvicted of obstructing justice and accepting illegal gratuity tried in 1988 on federal racketeering charge and convicted on 15 felony countsxe2x80xa6lee alexander democrat mayor of syracuse ny from 1970 to 1985 wa indicted over a 15 million kickback scandal pleaded guilty to racketeering and tax evasion charge served six year in prisonxc2xa0bill campbell democrat mayor of atlanta indicted and charged with fraud over claim he accepted improper payment from contractor seeking city contract xe2x80xa6frank ballance democrat congressman north carolina pleaded guilty to one charge of conspiracy to commit mail fraud and money laundering related to mishandling of money by his charitable foundation hazel oleary democrat secretary of energy during the clinton administration oleary took trip all over the world a secretary with a many 50 staff member and at time rented a plane which wa used by madonna during her concert tour nndan walker democrat governor of illinois from1973 to 1977 served le than two year of a sevenyear sentence for receiving improper loan a decade after leaving office gerry eastman studds democrat u representative from massachusetts from 1973 to 1997 the first openly g ay member of congress censured by the house of representative for having s exual relation with a teenage house pagehiram monserrate queen city councilman and state senatorelect who ha claimed to be an advocate of victim of domestic violence wa arrested for breaking a glass over his girlfriend face monserrate 41 a former cop won election to the state senate a a democrat in november 2008 james c green democrat north carolina state house of representative from 1961 to 1977 charged with accepting a bribe from an undercover fbi agent but wa acquitted convicted of tax evasion in 1997xc2xa0frederick richmond democrat u representative from new york from 1975 to 1982 arrested in washington dc in 1978 for soliciting s ex from a minor and from an undercover police officer pleaded guilty to a misdemeanor also charged with tax evasion marijuana possession and improper payment to a federal employee pleaded guiltyxc2xa0raymond lederer democrat u representative from pennsylvania from 1977 to 1981 implicated in the abscam sting convicted of bribery and sentenced to three year in prison and fined 20000harrison arlington williams jr democrat u senator from new jersey from 1959 to 1970 implicated in the abscam sting allegedly accepted an 18 interest in a titanium mine convicted of nine count of bribery conspiracy receiving an unlawful gratuity conflict of interest and interstate travel in aid of racketeering sentenced to three year in prison and fined 50000 ndaniel david rostenkowski democrat u representative from illinois from 1959 to 1995 indicted on 17 felony charge pleaded guilty to two count of misuse of public fund and sentenced to seventeen month in federal prisonmelvin jay reynolds democrat u representative from illinois from 1993 to 1995 convicted on sexual misconduct and obstruction of justice charge and sentenced to five year in prison wayne bryant democrat nj state senator wa convicted wa found guilty on all 12 count against him including bribery and pension fraudcharles cole diggs jr democrat u representative from michigan from 1955 to 1980 convicted on eleven count of mail fraud and filing false payroll form sentenced to three year in prisongeorge rogers democrat massachusetts state house of representative from 1965 to 1970 m000ember of massachusetts state senate from 1975 to 1978 convicted of bribery in 1978 and sentenced to two year in prisondon siegelman democrat governor alabama indicted in a bidrigging scheme involving a maternitycare program the charge accused siegelman and his former chief of staff of helping tuscaloosa physician phillip bobo rig bid siegelman wa accused of moving 550000 from the state education budget to the state fire college in tuscaloosa so bobo could use the money to pay off a competitor for a state contract for maternity care john murtha jr democrat u representative from pennsylvania implicated in the abscam sting in which fbi agent impersonating a rab businessmen offered bribe to political figure murtha wa cited a an unindicted coconspiratorotto kerner democrat governor of illinois from 1961 to 1968 wa jailed after the manager of two horseracing track admitted to bribing the then governor charge were filed after kerner left office he wa convicted in 1973nbarney frank democrat u representative from massachusetts from 1981 to present admitted to having paid stephen l gobie a male p rostitute for s ex and subsequently hiring gobie a his personal assistant gobie used the congressman washington apartment for p rostitution a move to expel frank from the house of representative failed and a motion to censure him failed under a democratic majoritydnc the federal election commission imposed 719000 in fine against participant in the 1996 democratic party fundraising scandal involving contribution from china korea and other foreign source the federal election commission said it decided to drop case against contributor of more than 3 million in illegal dnc contribution because the respondent left the country or the corporation are defunct sandy berger democrat national security advisor during the clinton administration berger fined 50000 for illegally removing highly classified document and handwritten note from the national archive during preparation for the sept 11 commission hearingsxc2xa0robert torricelli democrat withdrew from the 2002 senate race with le than 30 day before the election because of controversy over personal gift he took from a major campaign donor and question about campaign donation from 1996 james mcgreevey democrat new jersey governor admitted to having a gay affair resigned after allegation of sexual harassment rumor of being blackmailed on top of fundraising investigation and indictmentsjesse jackson democrat democratic candidate for president admitted to having an extramarital affair and fathering a illegitimate childgary condit democrat u democratic congressman from california condit had an affair with an intern condit covered up the affair and lied to police after she went missing no charge were ever filed against condit her remains were discovered in a washington dc parkxc2xa0eliot spitzer democrat new york governor resigned from office after being tied to a p rostitution ringsowande ajumoke omokunde democrat the son of newly elected u rep gwen moore wa booked on charge of criminal damage to property for allegedly slashing tire on 20 van and car rented by the republican party for use in election day voter turnout effort nnanthony weiner democrat take picture of his p enis and t weets it to under age teen and six other woman while his wife is carrying his child his p enis end up on the internet for all of time and resigns from officejohn edward democrat extramarital affair admitted to in august 2008 by john edward a former united state senator from north carolina and democratic party presidential candidate the affair wa initially reported by the national enquirer an american supermarket tabloid newspaper but wa given little or no coverage by many source in the american mainstream media123 the enquirer cited claim by an anonymous source that edward had engaged in the affair with rielle hunter a filmmaker hired to work for his presidential campaign and that the relationship had produced a child durin the time when his wife made a announcement that her cancer had returned and wa found to be incurable elizabeth died on december 7 2010xc2xa0maxine watersxc2xa0 democrat a a congressional ethic panel prepares to try maxine water for steering federal fund to her husbandxe2x80x99s failing bank a newspaper report that the veteran california lawmaker is embroiled in a separate corruption scandal involving her beloved hubby xe2x80xa6xe2x80xa6xe2x80xa6xe2x80xa6citing federal record the story say that a powerful lobbyist paid watersxe2x80x99 banker husband sidney williams 15000 in xe2x80x9cconsulting feesxe2x80x9d a she cosponsored a law aimed at saving a business that wa among the lobbyistxe2x80x99s top client the internal revenue service irs had determined that the real estate finance firm and others like it were xe2x80x9cscamsxe2x80x9d and the congresswomanxe2x80x99s measure would have overturned a federal ban that would have allowed the shady enterprise to keep raking in lucrative profitsfor year the firm acted a a middleman to help seller finance down payment so that lowincome buyer could qualify for mortgage insured by the federal housing administration fha the lobbyist who paid watersxe2x80x99 husband represented the nationxe2x80x99s largest such middleman sacramentbased nehemiah corp which stood to lose hundred of million of dollar if the ban wasnxe2x80x99t reversed by friendly lawmaker like water implemented in 2008 the federal ban wa never overturned but not for lack of effort on watersxe2x80x99 part the tenterm congresswoman sponsored legislation three time to stop the ban or repeal it once it became law she claim she did it because the program allowed hundred of thousand of lowincome family to become homeowner news of this latest scandal come a the house ethic committee prepares to try water for using her influence to steer 12 million in federal bailout fund to a failing bank that subsequently got shut down by the government in which she and her board member husband held share a few month ago the congresswoman got in trouble again for skirting federal election rule with a crooked fundraising gimmick that allows her to receive unlimited amount of donation from certain contributor instead of raising most of her campaign fund from individual and political action committee water sell her endorsement to other politician and political cause for a much a 45000 a pop allowing her to rake in hundred of thousand of dollar in short period of time neil goldschmidt xe2x80x93 democrat xe2x80x93 oregon governor admitted to having an illegal sexual relationship with a 14yearold teenager while he wa serving a mayor of portlandxc2xa0xc2xa0william jefferson clinton democrat xc2xa0 impeached by the house of representative over allegation of perjury and obstruction of justice but acquitted by the senate after a s ex a scandal with an internedward moore kennedy democrat u s senator from massachusetts pleaded guilty to leaving the scene of an accident after his car plunged off a bridge on chappaquiddick island killing passenger mary jo kopechnen,-0.03979590089759582
2005,2005,0,i liked your comment not because it wa sensible but because it wa so farny,0.6
2006,2006,0,blazeraddict blaine jungwirth afrika bambaataa yeah i got the same gift,0.0
2007,2007,0,is it night time where you live,0.13636363636363635
2008,2008,0,why dont school worry about teaching instead of dumbst for real arent our childrens education suffering enough with every hippie retard in the world making it worse you freak and you dainty feeling whining cause your parent whipped your little bad as when u deserved it are screwing the whole thing up,-0.1109375
2009,2009,0,more than half of living medal of honor recipient have endorsed romney,0.16666666666666669
2010,2010,0,no list is complete without peach city in brigham city now that is a burger joint also how did hometown drivein make the list in laketown but not labeaus labeaus put the r in raspberry shake,0.1
2011,2011,1,get thatdick outta your mouth so you can talk,0.0
2012,2012,0,i hope you are not setting the standard by using your real name on gc post,0.1
2013,2013,0,conference champ only we are not trying to pick the pecking order but give every school via their conference a path to play for the national championshipnnthis is so simple to get right why do these clown keep screwing it upnnwin your conference you play lose you dont,0.09523809523809523
2014,2014,0,corporation are peoplenngoogle corporate citizenshipnnhowever many also take it to mean that corporation should be regarded a citizen within a territory ie that corporation have citizenship of some sort this is usually based on the principle of corporate personhood in that in certain legal jurisdiction such a the united state company are afforded some of the same legal right a individual,0.06979166666666667
2015,2015,1,you didnt read the article and you are a ignorant putz,0.0
2016,2016,0,you are lucky to have any privilege at all after saying some of the most vile comment in the history of this blog,0.41666666666666663
2017,2017,1,are you really this stupid,-0.29999999999999993
2018,2018,0,pitbulls are not banned in broward county put one inside your bussiness and wait for the stupid maggot to be pleseantly surprised by fido,-0.35
2019,2019,0,ya and feed him more chocolate,0.5
2020,2020,0,cde2529cb2286129f8c64da529eb1620disqus gunjan diplzzzzzz mujh se naaraz mat ho you are angry coz i thought to close my ff di maybe people dont like it aur us larki ne bhi kuch soch samajh kar hi comment kia hoga that my ff is not good ab plz mujh se gussa mat honnae479ceb1494fc0ba42da261fcea5830disqus sadaf diaap bhi mujh se gussa ho plz aap tou gussa mat ho actually di meri koi id nahi hai aur na hi mein fb per hunmein tou comment bhi apni behen ki id se karti huni dont have an idaur waise aap ka chat box wala idea bura nahi hai,-0.2833333333333333
2021,2021,1,stfu your existence offends me,0.0
2022,2022,1,it much better than the left wingnuts who got u into this mess in the first place xa0like you susan,0.14375
2023,2023,0,you lack empathy is a fucking great drink,0.8
2024,2024,0,just because owebama came out of the closet doesnt mean you should all blindly follow suit,-0.40625
2025,2025,0,hmmm new io without new hardware to try on so far iphone announcement have been done at wwdc in the past numerous time already unless new ipod touch pop out of no where to demo it and bring siri to ipad 3 will see tomorrow how it play out,0.043181818181818175
2026,2026,0,i agree it is hard which is why i try to stay away from it because there is no way to really know who would be better,0.1361111111111111
2027,2027,0,yep you are officially addicted to polyvoreas am i p,-0.4
2028,2028,0,amazing eh talk about gaining experience and considering last year in college he probably only played 2530 game pretty incredible,0.225
2029,2029,1,ho xa0xa0jenbroflovskixa0fuck you you old fuck the real john mclainnxa0nthe real one from die hard,-0.038333333333333344
2030,2030,0,oneil is the best manager in the world fact love to see jose do what mart doe no chance,0.75
2031,2031,0,waaaaaaaaaa waaaaaaaaaaaannnlisten to those libturds whinexa0xa0 they know they are toast so theyxa0yap and snip likexa0little chihauhausnnno offense to chihauhaus intended,0.0
2032,2032,0,and we could put up a highstakes russianxc2xa0roulettexc2xa0game im sure a few people would choose to do that too like young girl choose prostitution people choose to be crack head the fact that you can blow the rent money on the roll of the dice and leave your child homeless is case in point,0.13333333333333333
2033,2033,0,we need to have a honest goverment and clean up all communist from any party now,0.48333333333333334
2034,2034,0,because kagawa isnt going to sell shirt to their favourite team,0.0
2035,2035,0,waiting to hear them say black huhblack okay now unhand yourself go and smoke a cigarettebetter isnt ityou relly should invest in hustler or playboy,0.16666666666666669
2036,2036,0,well he want to ban gay marriage even in state where it is currently legal he want to ban adoption for gay couple he think planned parenthood ha a hidden agenda andxc2xa0he wantsxc2xa0nno abortion even in case of rape,0.2166666666666667
2037,2037,0,there is a good team on the field idiot people get injured people slump to say gonzi and youk are no better at hitting than the fan is absolutely ridiculous and upsurd do rsn and the red sox a favor and stay at home and shut the fck up you are a prime example of what i am talking about if youre going to criticize then do it realisticly and stop pulling dumb sht out of your a a for the rabbit foot im not talking about luck here i am talking about a behavoir of the fan that is bleeding into the club house you try and perform while constantly criticized and have to endure stupid comment like you im not saying it is the main problem but it certainly doe not help anyone,-0.11915584415584415
2038,2038,1,you really are a complete moron yo must be one of those incompetent welfare leech who doe nothing but put a drain on every hard working person in this country cut the cord do something with your pathetic life,-0.35694444444444445
2039,2039,0,reallynsince when ha it become cool to defend him,0.35
2040,2040,1,nope it is a moron like you who need to shut up,-0.8
2041,2041,1,you are simply comically idioticxa0 or youre just a depressing foolxa0 either way youre still just a liar and an internet cowardxa0 cheer,-0.04999999999999999
2042,2042,0,cause you never know when youre gonna need one lol o,0.8
2043,2043,0,you are not better than your bedtime,-0.25
2044,2044,1,you are wrong idiot,-0.65
2045,2045,0,something tell me he is a burglar at night,0.0
2046,2046,0,president romneyxa0 sound really good now cheney for vp and were all setxa0 yeah thats the ticketromney cheneyxa0 and thexa0 motto will bexa0 just to piss off the liberal,0.55
2047,2047,0,of course iran ha been talking u to death for year in their development of nuke xa0 with obama and hillary they have willing ally to prolong it even further xa0 the israeli and believe or not the saudi and jordanian will not wait for obama knowing exactly who he support xa0 the arab have a much to lose because occupying them is also on iran time table xa0 simply put the iranian are shiite and the saudi and jordanian are sunni they hate each other deeply xa0 in this case enemy of my enemy is my friend at least for today,-0.05833333333333335
2048,2048,0,getting your face ate off,0.0
2049,2049,1,dont you get tennis elbow from jacking off a much a you do,0.2
2050,2050,0,nigga didnt even pinch the bitchhe a cowered thodeserved that as whooping,0.0
2051,2051,0,a frank yesterday a frank today a frank tomorrow i have been and always will be one big frank,0.0
2052,2052,0,tstev you really ought to get a life you accused me of being another commenter pretending to be a supporter of that commenters stance in another article long ago you post more than anyone i have ever seen and your post are always vicious petty and pointless and quick to whip out ad hominem attack you post so often that i wonder how do you pray tell make a living are you one of the 1 do you live in your parent basement im sure youll accuse me of being yet another abigail or something idiotic along those line by all mean deflect away from legitimate discussion thats the height of maturity,-0.06094696969696969
2053,2053,0,what muslim are currently being line up for hate,-0.4
2054,2054,0,i feel bad for the woman what would have made this story better is if the man attempted to rape her and she pulled a 9mm and gave that guy a dirt nap but who need gun gun are barbaric and rape murder and home invasion only happen in the movie and on tvnninstead this guy is gonna be in jail and all the liberal will think he is gonna be rehabilitated and he will become a contributing member of society on releasexc2xa0nnsuch a waste of tax dollar,-0.09999999999999996
2055,2055,1,bitchbe quiet somebody need to kick your as for talkin that stupid shithoe,-0.39999999999999997
2056,2056,1,you are a complete moron,-0.35000000000000003
2057,2057,0,android is everything steve job envisioned io to be thats why he hated it so much lmfao that wa apple most pathetic update yet that shit should 52 not os6,-0.27999999999999997
2058,2058,0,thats okif i get in trouble there will be million worse offill loot with the best of em,0.1333333333333333
2059,2059,0,the boy at epic mealtime must be proud,0.45
2060,2060,0,i like season 4 ok it wasnt a good a the later half of season 2first half of season 3 but it wasnt terrible or even merely bad,-0.11904761904761904
2061,2061,0,sholawhat planet do you live on you need to get down to specsavers blind or stupid,-0.32979797979797976
2062,2062,0,illegal cuban zombie castro revenge for sega genesis onlyfrom akklaim,-0.5
2063,2063,0,i believe in the mantra no risk no fun however nnon balance i would have to fall in line with the do not do it camp on this one having said all that there is an old snap of self on a dirt bike laying around somewhere with my young daughter clinging to me on pillion seat having fun but neither of u wearing crash hatsnni guess we all have rash moment,0.0875
2064,2064,1,you piece of scum according to the sa constitution this lady wa a black person hope your mother is the mother of all old cow idiot,-0.26
2065,2065,0,arsene wenger is a great manager of that there is no doubt and i for the life of me couldnt understand that substitutionhowever he is the manager not me and he may have had a sensible reason for doing it we dont know,0.8
2066,2066,0,i feel like shotime looked inside my dream and just picked a bunch of random shit out of it to make a show sheen caplan sex period piece retro science and sex,-0.35
2067,2067,0,shearnut that you may be correct i do not like people who want to destroy america,-0.2
2068,2068,0,what an honor to be able to see you so up close and personal i will be counting the sleep if i had a tail i would wag it,0.25
2069,2069,0,truthincaps for you to understandxa0 just a second doctor a patient for you in gaza,0.0
2070,2070,0,any chance they served deep fried anything on a stick at this event,0.0
2071,2071,0,lot of foul lot of free throw made comin up,0.4
2072,2072,0,i will fuck the shit outta of judge judy have her hollering order order order,-0.30000000000000004
