,Unnamed: 0,Insult,Comment,Sentiment
2886,2886,0,sanyu i suggest you get over cute and become competent intellectually if you reasoned like buess i would think you are compentent the way you sound make me think your brain is in you panty nbluess great reasoning great questioning and indeed you showed a sense of patriotismnsanyu pull your brain out of your panty have it in the right place you might reason better than you do here,0.5107142857142857
2887,2887,0,julissa is fuuucking annoying,-0.8
2888,2888,0,natesweetxa0nxa0nheh you said tightly then you said loosely,-0.12774725274725274
2889,2889,0,hi maryloving this weather unfortunately cant go farit figure,-0.5
2890,2890,1,i hope you liberalsprogressivessoc ialistscom munists who are commenting here are really proud of yourselves with your fi lth y comment about abxc2xa0 keep it upxc2xa0 it show who you really are a bunch of snarky ha te ful elitist de cei tful and dec eived useful id i ots of the darkxc2xa0 crawl away slim er,0.43333333333333335
2891,2891,1,yet here you are day after day supporting the paper by clicking on link and making comment increasing site trafficnnyou just cant cure stupid,-0.27499999999999997
2892,2892,0,wave back while holding up a sign sayingnnnthe pipe work better if you light it,0.3
2893,2893,1,wtf are you talking about more important shit like taking time out of your life to comment on me calling another nigga ugly hmm yeah your still in middle school,-0.08333333333333333
2894,2894,0,i hope the gobbly gooker is a unlockable character on wwe 13,0.0
2895,2895,1,im no liberal you cocksucker just not so stupid a fucker a to shoot a kid going for candy youre a puzzy that is scared of shadow,-0.7999999999999999
2896,2896,0,the kkkthe klu klux klanthe military wing of the democratic partynlol,-0.1
2897,2897,0,you calling others ignorant asshole hahahah that is a fucking joke,-0.6
2898,2898,0,added those quote at beginning and end of the track bwahaha it alsum,0.0
2899,2899,1,rec just shut your mouth with your neonazism you are just a weak minded social reject compelled to strong leader like hitler because you cant fend for yourself,0.03055555555555554
2900,2900,0,one of our best and most honorable president,0.75
2901,2901,1,if it so lame why did you read this or for that matter search this topic maybe you should think a little more before you make yourself look like a fucking hippocrate,-0.196875
2902,2902,0,yes man fell our pain but on the other hand we can handle they as you just need to show em who bos they can get they little attitude a long a they dont cross that line,-0.090625
2903,2903,1,you are an ignorant piece of sht,0.0
2904,2904,0,is it just me or doe that picture of david brock scream i can suck start a b 52,0.0
2905,2905,0,diablonnxa0 finally someone else seems to get it it just a game get over it people a someone who ha actually been in combat i appreciate them actually talking to people who have seen it todd if you want to realism join the military these are game game are fun your mad because of a regenerative health if thats the case dont play shooter xa0todds logic is rediculous the combat isnt realistic really no hey todd just play red river and stop writing article about this subject and like i said im a vet and the game dosnt piss me off your pissing me off it seems to me you think your doing hard nose journalism by questioning the realism of a videogame well todd in reality you failed and instead of badgering them because they used the word authenticity maybe you should spend more time reading a dictionary,-0.14215686274509803
2906,2906,0,well considering lebron james is pretty damn good in the post season exluding the final and peyton hasnt played his best in the post season itd have to be lebron peyton is not a choker though,0.4875
2907,2907,0,obama command the lead in under 36k a year and under bracket only romney is ahead for 36k and above income,0.0
2908,2908,0,that hexagonal crown match the watch so well a for modern watch i love the seiko orange monster,0.35
2909,2909,1,im a butch woman wont you come try and whoop my as you weak as sniffling little troll in fact better yet bring your wife alongshes almost hotand im sure shed hightail it away from you boy,0.109375
2910,2910,0,i can understand your appreciation for jack but did you really have to let u know what people call you next time please remember to check your punctuation you left the period out after start,0.06666666666666667
2911,2911,1,i am not dudeyou moron go back to your mother,-0.4
2912,2912,0,if you had a login you can find for yourself that apple did not invent nor is the technqiue used to pack in more pixel new on displaysearchnnhttpwwwdisplaysearchcomcpsrdexchgdisplaysearchhsxslindexaspxa0nnthe technique here along with the ipad wa invented by engineer in sharp a japanese display material manufacturer jsr,0.1278409090909091
2913,2913,0,were the people who were against civil right a dumb and angry a the people who are against gay rightsxc2xa0nnpretend for a moment that you put the constitution and bill of right a your highest document when evaluating u law and policy xc2xa0how can you possibly contend that gay marriage is an issue at allxc2xa0nnthe only way that you can contend that this is a huge issue is if you put the bible ahead of the constitution and bill of rightsignoring that this antitolerance thing isnt even universal across christianity xc2xa0nnso why again should religion be a leading factor in whether the legal and financial agreement that is marriage is allowed between two consenting adult regardless of genderxc2xa0nn,0.09459706959706961
2914,2914,0,way to go sweden getting your as handed to you by americansxc2xa0,0.0
2915,2915,0,ray lose ray lose nbaltimore on brink of losing noh ya baby red sox are on edge of a win against verlander,0.4
2916,2916,0,thank god the western conference playoff continue today the east is pure garbage,0.10714285714285714
2917,2917,1,are you guy fucking retarded youre trying to take picture of these girl you guy are worse than the scum of the earth,-0.5000000000000001
2918,2918,0,yes but he had a distinct view on this continent in particular something to the effect they had gold and diamond literally in the dirt beneath their foot yet in the thousand of year they walked it surface they never bothered to look down and imagine the possibility he elaborates on the subject,0.036111111111111115
2919,2919,0,yes he should of asked politely please stop shagging my daughter,0.0
2920,2920,1,pepes list updatednnnbest place to get your dick suckednnnhialeah swag housennbetween him and his mom te sacan la espumita,0.0
2921,2921,0,are you in thailand,0.0
2922,2922,0,jasamoah25 your a gloyte do one,0.0
2923,2923,0,what are you talking about,0.0
2924,2924,0,a car wreckxa0 this look more like a 500 car pileup on a fogshroudedxa0icy road to me those involved in the crash at the front canxa0hear the vehicle crashing onebyone in thexa0back with no end in sight,0.5
2925,2925,0,i sure hope bravo share this a i have posted before and have never been published,0.5
2926,2926,0,let me educate you you dont go vote for the nominee that is a 0 voteaxa0obama supporterxa0votes for obamaplus one for obamannow if you vote for the nominee it wash that plus one out to 0nsee how easy that wa,0.43333333333333335
2927,2927,0,noynoy aquino is an ugly mother f u c k e r,-0.7
2928,2928,0,the obama nation will rise,0.0
2929,2929,0,he will be charged with vehicular homicide he will probably do 18 month in a juvenile facility and get his record expunged after completing probation,-0.25
2930,2930,0,why dont the citizen of chicago that live in that area protect themselves they can think mayor daley and the rest of the puking liberal for this type of violence yes that is correct the puking liberal have taken away the right of the everyday citizen if every law abiding citizen had the right to have a ccw then thing would be different i say just go ahead and carry it is better to be judged by 12 then be carried by 6 if a few of these punk would be shot by a citizen i believe the punk would think twice before attacking citizen and dont tell me it happens in other city 49 state have ccw and they do not have these type of problem nnwake up people and stop waiting for the police to protect you and protect yourselfnnthank you,0.08534902597402597
2931,2931,1,whats funny a hell is rooster and you being married retard,-0.13333333333333333
2932,2932,1,chasm when you spam like the village idiot you are you will never get any convert to your stupid political bias cause xa0 nice pointy tin foil hat you got there too bud,-0.25
2933,2933,0,or robme scissor hand giving school kid a hair cut,0.0
2934,2934,1,would it make ya feel any better if he wa molesting girl youre really dumb but youre dumb by choice you choose to ignore everyone telling you fact but you choose to be dumb,-0.15625
2935,2935,0,fucking hotest blowjob ever,-0.6
2936,2936,0,ustaadji you are the greatest,1.0
2937,2937,0,fuck,-0.4
2938,2938,0,kuyt will wait to see what the new manager say about his playing time next season before he bolt,0.06818181818181818
2939,2939,1,you are a fool,0.0
2940,2940,1,sorry are you lost little boy the men are talking please take your whineing else werexa0and notice how no body sad anything about cod,-0.3958333333333333
2941,2941,0,probably it is memorial day after all a good joke on barajas part and a sign of a wounded vet,0.7
2942,2942,0,so i guess all the person had to do in the article wa bitch constantly about a game that so many people have bitched about for age and then they win the bitch over wow a far a stop trivializing violence go why dont you stop sounding like a big as c sucker and dont play game with violence then i get so tired of all these holy sounding type that get touchy about video game violencenn ive seen blood diamond a dozen time with the kid killing and getting killed and it doesnt even phase me one bit only because it not real sure there is an emotional sense there but not enough to make me write to hollywood saying gay sht like stop trivializing violence because it disgusting why doe a game have to tone it down when movie dont im not defending cod in the slightest and thats because i dont really care about the game but when i read the headline of the article i wa curious to see what others were going to say but i knew hand down it wa going to be an attempt to throw punch at a series that ha sold a lot of copy already all i can say is it doesnt matter how you feel when every other gamer that play the game probably can just deal with the game no matter if it change or notnn sitting on your overgrown as complaining about a game being this and being that just because you dont like it is stupid a hell i hate jrpg game and why i also hate anime with a passion because i cant stand cute crap i hate that overly sensitive b with the character i dont like japanese music either unless it instrumental war drum or something out of samurai warrior or kessen where it doesnt begin and end with a stupid asian chick trying to sound like shes an innocent little annoying 11 or 13 year oldi hate high pitch whiny sounding voice too and no japanese voice acting doe not mean better over american voice acting because it still suck regardless nnbut i dont go near the stuff even though my brother play jrpg game a lot and that mean i cant really escape it when were both in the same room and im studying while he just playing his sissy game the fact still stand that i dont intentionally go near thing i hate just so i can whine about hating it like cod hater constantly go near call of duty to claim that they hate the game when it easier to just simply stay away from it dont buy it try to pretend like it doesnt even exist i will not lie to anybody i like violence in my game people that walk around with a dck up there as cry foul about cgi character dying and getting hurt probably scream when the doctor come at them with a needle a far a call of duty having to change go well that depends on whether or not a lot of people want it to change and not just the people that bash the game on a consistent basis either im talking about people that really feel or believe it should change a few thing and have accurate reason why just simply saying cod is for 13 year old and need to change this or thatif anything the cod player are the one that should change,-0.1516647376543211
2943,2943,0,we are trying hard to beat yankee so you pick up a game on them,-0.3458333333333333
2944,2944,0,very very veryxa0very veryxa0very veryxa0very very important study,0.39
2945,2945,0,a role model to fool idiot and rube,-0.8
2946,2946,0,you dont seem to understand basic business concept,0.0
2947,2947,0,thats ridiculous everyone know men from mar are purple,-0.3333333333333333
2948,2948,0,who need these agency we can determine for ourselves what is good xa0who need some authority to tell u what is right or wrong a to collective impact on the planetnnwe would still be pouring waste oil in the ground to cheaply dispose of it if that mindset were allowed to predominate,0.13714285714285715
2949,2949,0,what you dont know about gulagscheck out the history of the soviet union warning it may disillusion you about communism and comrade stalin,0.0
2950,2950,0,lebron durant you two didnt deserve mvpnntony parker,0.0
2951,2951,1,taxing people at different level is not redistribution of wealth you fucking retardxa0 thats like saying a fat person is redistributing fat by eating more,-0.033333333333333326
2952,2952,1,stop wasting our air you idiot,-0.8
2953,2953,0,eustace tilley 20 david yankeeclipper1 thats cause youre not getting enough oxygen she sucked it all out of the room,0.0
2954,2954,1,how can you possibly be such an as hole all the time jesus this is exhausting people that say they have big dick generally have small one hahah believe it or not i defended your bitch as when you first joined the website pussy,-0.05833333333333333
2955,2955,0,im great rhunt you got to see a terrific game today,0.13333333333333333
2956,2956,0,gollythats cold comfort but none to worryby the end of this month israel will have taken care of the entire issue with iran and syria with one real nasty blow allah aint so great after all,-0.2
2957,2957,1,i am going to hate all over this page because im homophobic fuck off lesbian good thing that bitch died one le lesbo in the work,-0.16666666666666674
2958,2958,0,if it walk like a duckand quack like a duckits either guest speaking or in fact a duck,0.0
2959,2959,0,lltrixmass murdoch if youre going to call someone either stupid or ignorant you should probably end the question you ask afterward with a question mark not a period,-0.7999999999999999
2960,2960,0,lucky you sasha so whats your beef other folk tax are paying for your ride,0.10416666666666666
2961,2961,0,xc2xa0too many like it or not were suck with him for another 4 year unless the republican can pull a rabbit out of a hat the best we can hope for is a republican controlled house and senate,0.75
2962,2962,0,heaven forbid someone who is a bit of a celebrity should express nonliberal viewsxc2xa0 nnas a hockey fan myself i really dont think the very talented mr thomas need to answer to any lameass sport reportersor anyone elsexc2xa0 he entitled to his opinionsxc2xa0 after all prior to the current administration we used to uphold free speech for everyonennbesides he a stanley cup championxc2xa0 nuff said,0.30199999999999994
2963,2963,0,nwo4fuckinglife,0.0
2964,2964,0,all da hoe love me you know what it is xa0rack cityxa0bitchdisqus,0.5
2965,2965,1,do your job in hate loser,-0.8
2966,2966,1,crawl back under your bridge you miserable pathetic troll,-0.6666666666666666
2967,2967,0,you are full of schnike sir,0.35
2968,2968,1,ponyfags fuck off,-0.4
2969,2969,0,this is fucking primordial,-0.6
2970,2970,0,2010 he rushed 18 for 60 2011 52 for 170 i think the threat of him running loosened up the pas defense last year,0.0
2971,2971,0,racism will die when white people stop being racist,0.0
2972,2972,1,you are completely clueless,0.1
2973,2973,0,iran is going to be blow up one way or the other give it up,-0.125
2974,2974,0,i am a sale arborist in the dc metro area i have grown all too accustomed to the status quo set by service magic a a credentialed and educated professional in my field it ha become quite disturbing to work with the environment that service magic ha created ie a false sense of qualification of vendor to the consumer i have spoken with many arborist from other firm in our region and all say the same thing this could have been a beneficial service but without demanding proper insurance and credential from it vendor it simply becomes a mean for the unlicensed and uninsured vendor to gain business they are not qualified to perform this also leaf the qualified professional such a myself without a fair cost comparison to offer our client the fact of the matter is company pay ten of thousand of dollar a year for proper insurance not to mention the cost of education to aquire proper credential service magic come along and open up an outlet for those who have not performed their due diligence in aquiring these necessary benchmark to practice their craft to be solicited to the mass a qualified vendor it a shame and ha become a menace to the integrity of my profession and those of u who have worked hard and payed countless dollar to make ourselves a true qualified vendor my hope is that the people at service magic make immediate change in their qualification of vendor,0.06907051282051281
2975,2975,0,nolimits3333 please consider helping with thexa0president obama campaign we need people like you,0.0
2976,2976,0,until medical staff are held accountable in a court of law mistake like this are always gonna happen nh trust dont care about fine a it is ony tax payer money and not there own,0.33888888888888885
2977,2977,0,having read many of dragos other comment on this site it is not shocking he doesnt get game of thronesnnhodor ha more sense,0.195
2978,2978,0,because we got that dback killer zito going in game 1 he is undefeated v your dbacks this year lol that dont get old ever,0.16666666666666666
2979,2979,0,ill buy the rope so the tax payer dont have to choke up any money cw shovel,-0.5
2980,2980,1,you can get treatment for your dillusional inferiority complex you sad little troll,-0.32916666666666666
2981,2981,0,a lot like you and your life huh,0.0
2982,2982,1,damnit gw dont be such a pussy you liked the white you should have stuck with the white,0.15
2983,2983,0,proof or just another unfounded ridiculous republican opinion what were you watching fox news when they talked about the study that said fox news watcher are stupid you have just proven them right congratulation,-0.28253968253968254
2984,2984,0,we knew we were in trouble from day one xa0nobel peace prizefor what what afucking joke,-0.2
2985,2985,0,im so happy for them they really deserve it,0.5
2986,2986,0,your buddy repub turdraiboxcyndybnww nav are all having a party with the obama blow up doll you should join in before the koolaid get warm,0.6
2987,2987,0,they certainly have hospital for the criminally insane which judging from what ive read of his verified history is where kimberlin probably need to be,-0.39285714285714285
2988,2988,0,notborneverymin mickey bitsko micah carter im not going to make this easy for younnhttpwwwyoutubecomwatchvy3zadrfpb2knn,0.43333333333333335
2989,2989,0,in 1928 the federal government only consumed 12 of the national wealth today it consumes more than 40,0.25
2990,2990,1,no you are just stupid,-0.7999999999999999
2991,2991,0,the first draft dodger who became president wa bill clinton,0.25
2992,2992,0,massive pisstak,0.0
2993,2993,0,maybe they did so thanks to jeff van gundys outcry on that,0.2
2994,2994,0,my issue is not with the shoesxa0 i dont care about themxa0 if they invoke a certain response or emotion from someone it not up to you or i to say someone should feel that emotionxa0 who the heck are youxa0 thats how jesse feelsxa0 thats not how all black people and these comment demonstrate one of the reason why race relation have a long way to goxa0 there are too many ignorant people still breathing to have a serious dialogue about itxa0 stop telling everyone how they should feel and maybe just listenxa0 no one told the majority of american not to have an emotional response to 911despite the fact that they werent impacted directlyxa0did anyone berate you about getting over your hurtxa0 xa0you understand how you can be moved in that instancebut other people are just crazy because they werent a slavexa0 nnyou want to dictate how people talkwalkdressgo the bathroometc there seems to be no limitxa0 nnadidas ha every right to sell the shoe and people have every right to express how they feel about itxa0 you knowthe same way you express how you felt about 911,0.0008928571428571397
2995,2995,0,and he shrug off his rock once againtonyretardo,0.0
2996,2996,1,you are axa0 really wellrounded idiot arent you,-0.30000000000000004
2997,2997,0,mickey bitsko micah carter im sorry what is your dispute what is your argument youre asking me to check what out in particular,-0.16666666666666669
2998,2998,1,yuck imagine knowing a total fucking douche like you your mom should have swallowed dude she did this world an injustice,-0.3
2999,2999,1,ok now your getting silly which is not a surprise coming from liberal like you,0.0
3000,3000,0,when you know you are little by little achieving your goal it will help u inspire ourselves,-0.1875
3001,3001,0,must be what happened when they saw you soledadxa0 wearing your thong andxa0 nipple ring a you went to sleep in your fox holesecretly dreaming of the soldier next to you,0.0
3002,3002,1,id rather see you getting lynched,0.0
3003,3003,0,those chick are badass i would be puking if i had to drink a shot glass of either of those,0.0
3004,3004,0,omg jesse jackson go back to your cave slavey is over and ha been over a a country we know we messed up but to our defence it wa tribal leader who sold the slave to u but regardless slavery wa officially ended over 200 year ago and i doubt anyone alive is a former slave so cry me a river build a bridge and get over it already you wouldve thought all those people standing on that one soapbox it wouldve broke,0.03333333333333333
3005,3005,0,for a stupid ugly girl she seems to have gone rather well for herself big house expensive car million in the bank still i suppose all those girl crticizing her can match that and are better looking a well and the fella have better looking bird yeah right,-0.10204081632653061
3006,3006,0,wait till you see my romney imitation i love firing people corporation are people my friend and my favorite im not concerned about poor people,0.11666666666666667
3007,3007,0,you are a victim of the modern educational system,0.125
3008,3008,0,mibearfanxa0nxa0ntouche just letting you know i plan on talking an inordinate amount of shit about this out of all proportion i say,-0.2
3009,3009,0,to anyone bothering to evaluate obama on his word and action v having someone else do the evaluation for them he ha never been anything but a pragmatic centrist the problem with such a position is that the extreme left will claim a betrayal to an ideology never subscribed to the extreme right ha made it crystal clear that not only do they consider liberal subhuman criminal but they have no patience for moderate of any stripe and the overwhelming majority of people who are in the middle are not political wonk and dont have the time necessary to try and figure out the truth through all the spin so they are unfortunately left with the impression of whatever sensationalist press last got their attention,0.020982142857142855
3010,3010,0,gee scholarship for black only can you say racism,-0.08333333333333333
3011,3011,0,cy said 22xa0 june win that is lookingxa0 prettyxa0 close right now,0.5428571428571429
3012,3012,0,donpardo or it our worst nightmare a we slide to the 3rd or possibly 4th best qb in the division mercy,0.0
3013,3013,1,i bet you take monstrous shit,-0.2
3014,3014,1,you are despicable and disgusting,-1.0
3015,3015,1,i think one might get rabies from biting you do you actually read what you type youre a psycho and you may be newish here but you sound like this old fart who used to fill this forum with similar mindless drivel nnwhy do you hate romney so much clearly even such a mentally senile old dip stick like yourself recognizes that he is nothing more than the white version of barrack obama i dont really think youre on drug only someone mentally disturbed can sound like a a much a crackpot a you do,0.047058823529411764
3016,3016,0,ut there obviously a bit of sarcasm mixed in with some common sense in the post thanks for reading nnhave a nice weekend,0.1
3017,3017,1,and he helped to removexa0mubarak by xa0oh i forgot he wa demonstrating in cairo all those night back in 2010 xa0you are so blinded by your own political stupidity,0.0
3018,3018,1,youre reaching i am a proud american youre still an idiot,0.0
3019,3019,1,u are a sick moron,-0.7571428571428571
3020,3020,0,the boy just cant help itxa0 lolxa0 nna slime a day will keep obummer awayxa0xa0 go slick willynni guess you really cant call it a slime when he is kinda telling the truthxa0 nnromney 2012,-0.024999999999999994
3021,3021,0,hey wade why dont stop doing your hater and start argue with arguements actually you are not really useful not at all,-0.075
