,Unnamed: 0,Insult,Comment,Sentiment
0,0,1,you fuck your dad,-0.4
1,1,0,i really dont understand your pointxa0 it seems that you are mixing apple and orange,0.2
2,2,0,axc2xa0majority of canadian can and ha been wrong before now and will be againnnunless youre supportive of the idea that nothing is full proof or perfect so you take your chance and if we should inadvertently kill your son or daughter then thems the break and we can always regard you a collateral damage like in wartime and sorry butxc2xa0the cheque in the mail,0.17
3,3,0,listen if you dont wanna get married to a man or a woman dont do it what would it bother you if gay people got married stay in your lane do you let them do them and your god is so nice but quick to judg if your not like him thought you wasnt suppose to judge people,0.37
4,4,0,cxe1c bu1ea1n xuu1ed1ng u0111u01b0u1eddng biu1ec3u txecnh 2011 cxf3 xf4n hoxe0 khxf4ng ncxe1c ngu01b0 dxe2n ngu1ed3i cuxed u0111u1ea7u chiu1ee5 nhu1ee5c cxf3 xf4n hoxe0 khxf4ng ncxe1c nxf4ng dxe2n giu1eef u0111u1ea5t u1edf vu0103n giang cu1ea7n thu01a1 cxf3 xf4n hoxe0 khxf4ng nnru1ed1t cuu1ed9c u0111u01b0u1ee3c gxecxa0 thxec chxfang ta u0111xe3 biu1ebft nai cu0169ng yxeau chuu1ed9ng hoxe0 bxecnh nhu01b0ng u0111xf4i khi hoxe0 bxecnh chu1ec9 thu1eadt su1ef1 u0111u1ebfn sau chiu1ebfn tranh mxe0 thxf4inkhxf4ng cxf2n con u0111u01b0u1eddng nxe0o chu1ecdn khxe1c u0111xe2u u0111u1eebng mu01a1 thxeam nu01b0xe3,0.0
5,5,0,sdl ok but i would hope theyd sign him to a oneyear contract to start with give him the chance to be reliable and productive but give themselves the out if all his time off ha hurt his playing skill or if he fall back into old habit,0.19999999999999998
6,6,0,yeah and where are you now,0.0
7,7,1,shut the fuck up you and the rest of your faggot friend should be burned at the stake,-0.4
8,8,1,either you are fake or extremely stupidmaybe both,-0.3125
9,9,1,that you are an idiot who understands neither taxation nor woman health,-0.8
10,10,0,jdstorm dont wish him injury but it happened on it own and i doubt he injured he looked embarrassed to me,0.6
11,11,0,be carefuljimboog ha a fork with your name on it,0.0
12,12,0,tonnyb or they just dont pay attention,0.0
13,13,0,hmmm perhaps some who are too pigfaced to get laid and therefore have zero chance of getting pregnant from such activity hold something against woman who can idk stream of consciousnees thought after looking at her,0.16666666666666666
14,14,0,barrettmarson huh her income wa 21912 her spending wa 5470 my math put that at 249,0.0
15,15,1,for some reason u sound retarded lol damn where u been negro,0.13333333333333333
16,16,1,you with the racist screen namennyou are a pieceofshit,0.0
17,17,0,oh cheating a well1966 cup wa a cheat fest you still dare to post that commentshame on you lol,0.8
18,18,1,your such a dickhead,0.0
19,19,1,your a retard go post your head up your,-0.9
20,20,0,eephusbluexa0makes you want to say mike macwhogal,0.0
21,21,0,httpwwwyoutubecomwatchvtlyllphkru4,0.0
22,22,0,and you know theyve burned hole in all the carpeting,0.0
23,23,0,you are a land creature you would drown,0.0
24,24,0,to all those doomandgloomers the chickenlittles who claim the sky is falling and that society is collapsingcanada ha had gay marriage nationwide for year where is the disaster where is the collapse and the persecution youre shouting about where is it please show u some example because it starting to look like your threat and fear and warning are nothing but hot air,0.22222222222222224
25,25,0,craig we have been saying from the start that this is a very entertaining showxa0 it awakens the horny little goth in mexa0 i met my boyfriend during the first season and one of the first thing we did wa watch ahs at my housexa0 i know he like me and all but to this day he is sure i am far creepier and kinkier than he could ever bexa0 thanks american horror storyxa0 sweet clam love you,0.26125
26,26,0,strange you are talking about that when there were chelsea fan in here belittling the community shield,-0.05
27,27,0,but how would you actually get the key out,0.0
28,28,0,oh cool some more internet point for your collection,0.425
29,29,0,even though i think there are better coach out there i am glad del negro is keeping his job i never thought he got enough credit those year when he took those average chicago bull team he coached to the playoff 2 year in a row,0.2125
30,30,0,russellpianoxa0nhmmmmhow can we spin obama honoring vietnam troop a something negativeanswer doesnt matter look at our follower theyll take anythingnnnobama team xa0hmmm how can we make the liberal messiah look better in light of the revelation of his leaking classified information to the new york timesi know let have a bogus photo shoot at the viet nam memorial that will make obama look like he care about vet but first well have to clear all the vet out of the immediate area because they cant be trusted,0.2772727272727273
31,31,0,a good article which for all the good it will do could have been delivered to a brick wall,0.7
32,32,0,head up warninganother source of funding for medium matter is peter lewis of the progessive insurance company you know those auto insurance commercial that run every 5 minute on cable television featuring the gal who look like a blowup doll with red lip andxc2xa0a perfectly round mouthif you know what i meannif you have progressivexc2xa0auto insurance just know that part of your premium is going to fund a progressive liberalxc2xa0organization hell bentxc2xa0on destroyingxc2xa0our country and our free speech their mission is toxc2xa0bring downxc2xa0hannitybeckdobbslavinlimbaughboortzetc we must not let them win,0.2
33,33,0,sdnoriko lol a if capcom listens watch them fuck this up too i hope i am wrong i love okami,0.1
34,34,1,allinit123 yourxa0hypocrisyxa0is sickening you ignorant loser,-0.9
35,35,0,fast furious didnt work out like they planned did itlololololololol,0.2
36,36,0,mitt isnt the best candidate for presidentbut going against the worstxa0candidatexa0ever should help him tremendously xa0lolxa0nnobama is one and doneit could happen no other way,0.46527777777777773
37,37,1,i cant believe the stupid people on this site that have no idea what is going onxa0 you foolsxa0 you are all useful idiotsxa0 they are hiding the truth because you fool who protect him would look like the useful idiot you are,-0.25
38,38,1,fucking behave then you prick,-0.6
39,39,0,the only other relevant fact is that he is destroying america,0.018750000000000003
40,40,0,you are a liar,0.0
41,41,1,is that it your sum total to any conversation is first abuse and then calling them a troll you are a typical socialist idiot keep up your non existent class warfare it is a pointless a you,-0.19333333333333333
42,42,0,beanstalk briview welp then nbw right,0.2857142857142857
43,43,0,good job fella i didnt quite read the rule about a signature piece but i guess that wa a good a any i found some great blog to follow and to share over at g if im not commenting on your blog it because i always throw my two cent in when i post my share add me on there if you are a googler nhttpsplusgooglecom109258118458627782001posts again congratulation to the winner and i hope we get the chance to submit something else this wa fucking fun,0.625
44,44,0,i say hang is as in the center of the town to let it be known that this type of behavior get this type of punishment the lady had a kid 1 week ago woman arent safe to have sex after child birth for at least 6 week so even if this wasxc2xa0consensual it would have been wayyyyy too soon and hurt the lady i am so glad the the baby is so young and will not remember this event happening in it house and i hope the mother recovers quickly,0.17222222222222225
45,45,1,faggot,0.0
46,46,0,you right if you are relaxe then you can give better result or perform and your identity should be from your work,0.39285714285714285
47,47,1,aimless abe you are a delusion weirdo that should be locked up inside and kept away from computersxa0 anyone who doubt the lunacy of abe the moronic prog frog from nyc please read this thread and you will see abe completely come apart from the seam and go off the deep end,0.05
48,48,0,that i do not doubtnnas a blackberry clonennbut your original argument wa not that android would have existed just that android somehow predates io development,0.375
49,49,0,okc should work out a deal to get a pg who play more like parker or cp3 i think nash at the point and move westbrook to sg that team would be unstoppable imagine the shot nash would create for durant then westbrook would be at his natural position too the guy doesnt create shot or distribute,0.3
50,50,0,mahers show go on and onnpalinsxa0 alakda show get cancelednnisnt the free market wonderful,0.7
51,51,1,even a a troll you are a pathetic failure,-0.6583333333333333
52,52,0,grazie mille sabrina sei cosxec dolcennbaci,0.0
53,53,0,yeah well it would still be better than letting them sit there for 2030 year on my dime before sticking a needle in their vein i say give them all a noose if they choose to kill themselves so be it,0.5
54,54,0,umnxa0nholy fuck i need a cigarette,-0.4
55,55,1,youre a moron truth is beyond your reach,-0.8
56,56,0,you seem wistful,0.0
57,57,0,damn speedy recovery paulraining prayer down on you,-0.15555555555555559
58,58,0,the laugh you two heard were triggered by memory of his own highflying exit off moving beast,0.44999999999999996
59,59,1,your antisemitic rant are not welcomed here you are a racist moronnfu,0.0
60,60,0,nonstopdrivel wa fredex on this team,0.0
61,61,1,god youre tiresome get a life you loser,-0.5
62,62,0,stop pretending ur not bradley side youre the bsare u blind dont give u that stupidxa0longxa0explainations of yoursxa0youxa0xa0sounds like that 2 idiot judge exactly carbon copy arum we need our moneyyyy bacckkkkkkk,-0.35000000000000003
63,63,0,fucking weird game man,-0.45
64,64,0,i told you i would give it if you did you started acting likje a tough guy behind your mom computer then i asked you 20 time for an address and you still wont give it,-0.262962962962963
65,65,0,i dont know if lewis is a little boy or little girl either way it becomes the third on my list of petulant idiot you will understand when you grow up ask an old bastard member of your family to explain such action cannot be tolerated how come you blame the line judge weird,-0.184375
66,66,0,thats a pathetic flop fuck you jvg,-0.7
67,67,0,why should they bother improving io if they sell more phone than they care to produce these advice are better served to the alsoruns wp first and foremost,0.4166666666666667
68,68,0,spursruss i live in argentina and it not all argentinian the problem being those who are loud on the issue are ill educated and you can be sure they wouldnt be rushing to fight anyone they would be cowering in the background my wife is argentinean and she is the first one to recognize the stupidity of the claim some of muppet think they fought their independence against the uk moron the lot of them the answer is simple if we were the leading colonial force you would be an english speaking country you arent because werent it wa spain portugal france our interest were commercial also the worst part is they themselves exterminated the native the spanish started it but actually it wa the newly formed argies which did most of the killing of the native lovely eh clueless stuff you wonder why the government get away with corruption so many ignorant people thats whyyou shouldnt judge all by the standard these a huge amount of argies who see the cristina drum beating for what it is the same a all president of argentina do using it to cover their failing,0.006136363636363637
69,69,0,you better hope because the marlin have a history of giving up their superstar,0.5
70,70,0,well you guy have gone and done it now you put the word china and chinese up the required number of time for the dating asian ad to come up evidently m zhang 50kg and 168cm for a bmi of 178 from hunan china want to meet me she ha her little mouth open like shes speaking whats that you ask zhang well yes a a matter of fact i am a physician why are you clapping your hand together and jumping up and down stop that squealing young lady and exprain yourself,0.0009920634920634885
71,71,0,you mean like your off topic obama rant bellow,-0.3125
72,72,0,i hope they do it inconjunction with july 4,0.0
73,73,0,surely will be a crushing blow when he doesnt get the next four year would you consider leaving the country,0.3
74,74,0,i havent watched fox news in year true,0.35
75,75,0,are you in france,0.0
76,76,0,ill take that tempo really hate the heat,-0.65
77,77,0,alexis bledel can act wait can she i have this blind spot when it come to impossibly beautiful woman shit maybe she cant act fuck what the hell do i do nownnwhat the hell do i do now,-0.06250000000000001
78,78,0,i like your commentsnhowever i would go one step further it not time to let the people of il fight backnrather the citizen of il just need to fight back period ni will carry next time i travel into little beirut ie chicago,-0.046875
79,79,1,fact georgia passed a strict immigration policy and most of the latino farm worker left the area vidalia georgia now ha over 3000 agriculture job opening and they have been able to fill about 250 of them in past year all you white real american who are looking for work that the latino stole from youwhere are you the job are i vadalia just waiting for youor maybe it the fact that you would rather collect unemployment like the rest of the tea klaners you screamyou complainand you sit at home in your wife beater and drink beertypical real white tea klan,0.10714285714285714
80,80,1,of course you would bottom feeder,0.0
81,81,0,mxe1tenlosnhttp1bpblogspotcomyvszmvv2irwtmo8kfaugmiaaaaaaaaa0knllaahknniss1600killitwithfirekillitkillitwithfires670x394132457jpg,0.0
82,82,1,you arexa0 a fukin moron xa0xa0 you are just butthurt that you got rejected on wikipedianncall yoursilf scolar or whateverxa0 i am better than youxa0 just 14 and already a wikipedia administratorxa0 you are just a stupid ashole,-0.3666666666666667
83,83,0,he is doing what any president doe on this dayni do not recall if other president appeared at the wallnnelection year yea but then again you would never say anythingnif he did not appear you can not have it both way,-0.125
84,84,0,yeah and youre a fing expertgo back to picking through trash barrel you tool,0.0
85,85,0,those trail will definitely get plowed regardless of the investigation theyll just see it a easier to plow the area than deal with it and once they got plowed i would never return or risk getting stopped and heavily questioned by the popos nnps all the stupid comment are unnecessary it really easy to be cold and heartless and act like you dont give a fuck but id like to see these anonymous commentator talk shit like that in front of this person family or even their own mother grow up child and learn some respect,-0.17407407407407405
86,86,0,suh had a sack the last time they played,0.0
87,87,0,and you are support argument aholennnot everyone game on their pc either xa0spec whore miss the point entirelynni prefer the mac to my daily work xa0that being said im also a big believer in the best tool for the job and there are certain thing that pc do better database and server for instancennthe thing is that you havent proved anything other than an anti apple bias and name calling guilty myself to get your attention id just juvenile,0.04880952380952381
88,88,1,you are a fucking dumb as go back to you xbox dickhead grow up you little fanboy,-0.1875
89,89,0,you know what would be fun if you guy talked crap back to u more entertaining,0.1
90,90,0,beeline sidneycatsby im assuming you are in school in the state,0.0
91,91,0,they should put all the gay and lesbian on an islandxe2x80xa6xc2xa0 oh wait there is manhattan,0.4166666666666667
92,92,0,yolo this is hilarious canyon student are so racist even though most of u are mexican fuck gabby,0.15
93,93,1,let see your paper arealconservatinntill then shut the fuuk up stickychin,0.0
94,94,0,an interesting angle of organized religion is that religious persecution is never ok unless your defending your own religionxc2xa0 you all arent victim of religious oppressionxc2xa0 you are the oppressorsxc2xa0 btw im not gayxc2xa0 i just love how you people try to defend your persecution of others while claiming your are being persecuted,0.18214285714285713
95,95,1,correction bitch you dont think it superb because your hating as doesnt know talentand again i am still waiting on you to submit a video of you singingwhere is the youtube link i am sure you will get all kind of rave review lol,0.7250000000000001
96,96,1,i think the only trickle that effected you wa the trickle of sperm your dad gave your mom and most of that trickled down her leg go back to sleep we will wake you when you are needed again,0.08611111111111111
97,97,1,and you keep on your knee and keep telling yourself that is a sausage in your mouthxa0 and that is cream cheese you are swallowing,0.0
98,98,0,what wa that like 2000 word about nothing youre going after andrea mitchell what wa fox infomercial not broadcasting yesterday how about the apology issued for the epa drone and yet here you are attacking andrea mitchell about some stupid gas station gimmicknnheres another newsflash for you mr romney r1 is out of touch we all already know it mr romneys amazement wasnt just about some gadget at a petrol filling post but that people could actually buy food product there and that they actually eat itnnthis very second mr romney isnt even carrying a wallet and it is very likely that he doesnt even know where it is im still waiting for someone to ask him the tough campaign trail question of how much doe a gallon of milk costnnandrea mitchell and gas station food unbelievable,-0.15486111111111112
99,99,0,rourke need to give me a fucking likexa0xa0jwoude23xa0hows everyone doin,-0.6
100,100,1,fuck you both,-0.4
101,101,0,powersnnmsnbc is far far more biased and hostile in it comment than fox at least at fox there are usually opposing view msnbc is just a shill for the president and they keep having to fire their host for all the outrageous remark they makennnow cnn is getting almost a bad a msnbc,-0.2214285714285714
102,102,0,what horrible trade are you talking about,-1.0
103,103,1,and retard like you back to the institution,-0.45
104,104,0,weapon lol he an idiot an waste of human space had it made and ruined it all,-0.05
105,105,0,not a big fan of rondo but the dude can balli wouldnt classify him a a big talker just trying to psyche himself up,0.0
106,106,1,pig maher you forgot your med again you know you are one sick sob so dont forget,-0.7142857142857143
107,107,0,it not just the rich screaming about taxesxa0 it the average middle class american who pay hisher tax and doesnt see the benefit of those tax but instead see wastexa0 i pay federal tax but i dont use public school im not collecting any govt welfare or benefit i pay for my own healthcare etcxa0 i use the road and sewer so i dont mind paying the city taxesxa0for thatxa0 my trash pick up is private so i pay that directly to the trash companyxa0xa0everyone should pay for what theyxa0use notxa0based on what they makexa0xa0ifxa0one want to be a part of society one shouldxa0contribute and pay their fair sharexa0 that includes the rich or poor,0.14545454545454548
108,108,1,mr king isnt it about time you either grow a pair of ball or join the democrat who will love a pussy cat like you,0.5
109,109,0,im amused by the fact that weblog con drop any issue once it turn into a losernnthis is an expression of that amusement,0.0
110,110,0,gabrielxc2xa0 xc2xa0getting time to blow that horn,0.0
111,111,0,exactly like i dont really give a shit how fat a person may or may not feel but it really is shitty when your clothes dont fit and not in a im so gross way but in a i cant very well leave the house naked way,0.13125
112,112,0,welfare queen into a whore not a crack whore xa0i think a whore is a more productive worker than a welfare queen,0.5
113,113,0,political correctnessnnpolitical correctness is a doctrine fostered by a delusional illogical minority and rapidly promoted by an unscrupulous lamestream medium which hold forth the proposition that it is entirely possible to pick up a piece of cht xa0by the clean end,0.12222222222222223
114,114,1,what an as you arefunny i see a lot more of you nut in car then i ever have of pilot in pane,0.5
115,115,1,you can take international law andxa0 shove it you are such a schmuck i don t know why i even comment on your idiotic post the peace activist on the ship started hitting the soldier with weapon in order to kill the,-0.2222222222222222
116,116,0,blown is a little pissy after he applied for a union job and wa turned down he is just another good republican minion spreading today message,0.11898148148148147
117,117,0,if you dont have a teleport and airmix ups you are nothing to me,0.0
118,118,0,stop trying to sound like a victim bitch dont understand men dont have the same temper and not the same thought go through ur mind than ours u put a nigga on da spot get up in his face and start throwing yo stank breath on u believe me u got it coming yal go no right period,0.036428571428571435
119,119,0,robert moroni you fuckin dimwit do you know what a parody is it a fuckin parody of fox news and it sound accurate to me,0.4
120,120,1,the most evil callous vile creature in all of mythology is your made up god stop killing and eating baby you dirty christard,-0.3666666666666667
121,121,0,oops xa0how embarrassing for me you are right people1st i bow to the superior movie intellect of your son,0.4928571428571428
122,122,0,if you throw trash out your window you get a yellow star bumper sticker,0.0
123,123,0,once more we see where the soft immigration policy ha let the citizen down i bet they come from a family who have le education than a retarded hampster yet were given a nice new life in britain reap what you sow,0.06346801346801345
124,124,0,nope not working for me either322334wwwfacebookcomannagillmodelnn nnyou have my email,0.0
125,125,0,that jump shooting bit get old when you dont get call on contact and get your shot thrown off you look for separation and you jump shoot especially if you aint big which is most team because bigs and longs are rareexpensive at pro level,0.15
126,126,0,this wa a tough loss for u right now there are guy blowing each other in the locker roomnnscott brook,-0.07605820105820106
127,127,1,youre a complete and utter moron,-0.23333333333333336
128,128,1,your still a loser man we must have really gotten under your skin lol,0.5
129,129,0,the ignorance here is astounding clearly it say in the video that cleveland wa already convicted of rape and is serving jail time for it he guilty she wa raped for all of the moron whove said ugly statement about her or attacked the veracity of her story the only determination that this court is trying to make is whether cash money should be held liable i think it reasonable that when you invite someone to make a professional presentation at your company that you provide necessary protection for that individual i dont care whether cleveland wa employed or just a hangeron a professional guest should not have been left unattended in the hand of someone dangerous that wa there admittedly with baby and slims knowledge and permission if you went to a store and were attacked by an employee or a friend of the bos who wa permitted to hang around premise would you not hold the company responsiblexc2xa0,-0.11333333333333331
130,130,0,fuck hard then fuck slow then fuck hard and then start again,-0.34722222222222227
131,131,0,axlrodesxa0were you here for the wide receiver drama,-0.1
132,132,0,are you fucking kidding me no mirror fuck you freesteam,-0.5
133,133,1,nothing wa confirmed in the 19th century you moron there wa no modern medical science to prove anything dont try to quote from the same period of time that brought u the spanish inquisition you are the lowest of the low i feel sorry for you,-0.125
134,134,1,my best friend who is allergic to wheat corn soy red dye yellow dye pistachio tree nut kiwi cherry orange banana and seafood if she get anywhere near the smell of seafood her lung constrict and she can no longer breath last week she got cut by a dog leash that had pistachio on it and almost went into anaphylactic i know a little about food allergiesxa0nni asked my friend if she thought it wa rude and selfish of someone to want food allergy so they could die she said you are a bitch so i do not really think it is insulting that she want food allergy so she can die i think were back to youre a bitch,-0.08977272727272727
135,135,0,so not focusing on boston v miami for a minute who the scarier opponent sanan or okc,0.0
136,136,1,floyd ha a better knock out percentage than pacman you dumb fuuuuck,0.0625
137,137,0,so wat have u bn doing all along if u want to train them nwwe thot yo presence must strengthen the strike force bt proving otherwsshame,0.0
138,138,0,the dean of mean is a typical tory who belief there one law for him and another one for everyone elsenbig steve better get around to firing everyone at election canada and replacing them with tory hack before they really get into what the tory did in the 2011 campaign,0.055208333333333345
139,139,0,oh fab we have a tennis player who ha a sense of humour and who can smile mr murray please note mind you he ha left it too late to cheer up misery gut,0.0
140,140,0,you are repeating yourself mate,0.0
141,141,1,you are one sick puppy,-0.7142857142857143
142,142,0,very true indeed ive tried to sit down and study for hour straight without any break and im not nearly a effective a when i take a few break,-0.00011111111111111738
143,143,0,so da fuck wat if he prasie the devil look where he at keep doin ya thing my nigga,-0.4
