,Unnamed: 0,Insult,Comment,Sentiment
1069,1069,0,hi allyxa0 glad you liked gambler galxa0 she would be my alterego if i had a bunch of moolah to spendxa0 alasthis is not the casexa0 i like the penny slot too but you can sure cram a heck of a lot of money into those machine if youre not carefulxa0xa0 sheeshnhugs,0.5333333333333333
1070,1070,0,guess what op im a ireal girli that ilikesi wearing make up ilikesi wearing my hair down ilikesi being dressed nice and suck at call of duty smy strategy is to spin in a circle and shoot everywhere shoot those motherfuckerssnnnwhat now,0.2222222222222222
1071,1071,0,xc2xa0supposedly a very rare pattern in the c position or sometimes referred to a the bullish doggystyle manuever take your pickxc2xa0 lolhttpwwwscreencastcomusershoofheartedfoldersdefaultmedia63e5082f26924214865c4701ba356a88very suspect thoughif someone ha posted this my apology ive not seen it,0.39
1072,1072,0,maybe he is canadian would explain why he is gutted not to be going,0.0
1073,1073,0,oh fuck yeah he not kidding guy it image from the attack and holy shit they are in a whole new world of graphic,-0.05272727272727275
1074,1074,1,evel dick get my vote james r is a very creepy looking man mr rogers look alike plus he whined like a little bitch when janelle destroyed him in the otev pov comp,-0.41875
1075,1075,0,adam12 hey a12 wa thinking about you today cause i wa listening to some old blue how is it going,0.05
1076,1076,0,i have watched the video over and over again and with all the evidence ballotelli did not delibratly stamp on parker head for a start parker wa behind mario when he fell and in doing so knocked ballotelli off balance and tripped over hitting parker in the head thats what the ref saw the rest is history,-0.4
1077,1077,0,yeah theyd pick up the trash then go thow it in the yard aroud their trailer,0.0
1078,1078,1,berethor099 go ahead and try dude go fucking ahead,-0.6
1079,1079,0,so a single parent is better get off your fucking high horse and shut the fuck up can you even imagine the trauma the two girl will feel and the loss of the other female partner wont change the other mother from being gay i hope you realize,0.04440476190476191
1080,1080,1,rob you have proven your point already we understood you are an antisemit you can relax now,0.0
1081,1081,0,faux is a better source of animus,0.5
1082,1082,1,it is a great honor to be a zionist you are garbage a retarded idiot,-0.26666666666666666
1083,1083,0,sorry but thats just a dumb statement youre comparing some 3rd party promo to apple own functionality for example if this were a reference to a carrier removing google navigation and forcing customer to use telenav youd have a valid argument but not in this case nnif you want to make odd comparison let talk about how the iphone fucked everyone on sprint who enjoyed 1yr contract longer return period and other perk that got taken away all because of the iphone see thats why i like android because they dont make the carrier take one up the as and screw their user out of perk theyve enjoyed for year,-0.018518518518518504
1084,1084,1,sgboyget back to your coti hear your parent calling for you,0.0
1085,1085,0,peevedmichelle um good question please email pollybloghercom,0.7
1086,1086,0,look like you have a stormer problemthe same team that beat the bull twicehabs and jean were greatmorne spiesxa0and hougaard wa below parcrusty the clown dont belong in this company,0.0
1087,1087,0,joey barton only ha a twitter account because he want people to massage his ego,0.0
1088,1088,1,you are a pig,0.0
1089,1089,0,got your back here rdale good post typical of the gun nut in utah,0.17777777777777778
1090,1090,0,his wrist might be bothering him he got a chip floating around in there,0.0
1091,1091,0,based on the architecture stucco building and foliageoh and the dancing gay black kid im betting this is from florida,0.125
1092,1092,1,fly away gaypusssyfly away,0.8
1093,1093,1,were not the loser butxa0 you and this country are,0.0
1094,1094,0,you have a beautiful body whats wrong with a man looking at a woman with a beautiful body especially nice hip if im stalker for that then every dude i know is a stalker a well,0.55
1095,1095,0,look like a case of cat on keyboard disease,0.0
1096,1096,0,go get them egyptiansxc2xa0 kill them allxc2xa0 we will be right behind youxc2xa0xc2xa0 hahahahehehenngenesis 1612 xc2xa0he will be a wild as uncivilized of a man yismael and his descendant his hand will be against everyone meaning a robber per rashi and everyones hand will be against him meaning everyone will hate him and will attack him per rashi and in the presence of all his brother he will dwell meaning his descendant will be many per rashi,-0.06285714285714288
1097,1097,1,commenterxa0 your very childishxa0 grow up and be a manxa0 stupid remark like yours just prof that you are a little boy and have yet to understand what it mean to be an adult,-0.19999999999999998
1098,1098,0,awesome font and color on your card,1.0
1099,1099,0,not tonight tv844chill with thatnthe brewer and dodger fan are just enjoying the gamenwherever they are hoping that their team winsnsimple aint it,0.5
1100,1100,1,provide proof faggot,0.0
1101,1101,1,your mother is the clubhouse whore,0.0
1102,1102,0,your mother,0.0
1103,1103,0,thats because you posted all lie and bullshyt,0.0
1104,1104,0,his poor momshe seemed pretty cool how the fuck did a person so nice end up raising such a cunt,0.06666666666666665
1105,1105,1,take your testament and shove it,0.0
1106,1106,1,suck ya dad dick ya stupid slut he waiting 4 u u probably ugly a fuck damn i know it suck to be you trollin on a joke i made fall back b4 ihurt yo feelins ho,-0.475
1107,1107,0,xc2xa0yes god gave u free willxc2xa0 no matter what the sin is sin is a choice people werent born gayxc2xa0 somewhere in their environment or upbringing they chose that lifestylexc2xa0 there are people who enter it and leave it every day,0.4
1108,1108,0,i dont go to the wood this time of year to hot toonxa0many chigger i stick to shore until it cool off,0.3
1109,1109,0,glove on the baby please,0.0
1110,1110,0,why dont you think hell be worth it,0.3
1111,1111,0,there far worse thing happening in africaand wheres your humanity towards africamore than half of mali ha been taken over by fsa best mate al quaidamauritania still ha a slavery system going onchadnigerdarfursouth sudan are on the brink of faminesomalia once again fsa best mate al quaida ruining the countrynorth eastern congo there death and mass rapesdont you reckon some of the issue in africa are far worse than syrian regime battling terrorist,0.1761904761904762
1112,1112,0,you are 100 spot on in regard to that little brat,-0.1875
1113,1113,1,seems like you are on tik you moron are all people of your colour rapist of mother and child i dont think so stop making idiot comment,-0.8
1114,1114,1,you certainly come off a an arrogant sob your right end when the safety of others begin i dont give a rat arse that you hunt but keep your bullet along with your second hand smoke away from me sheffield village is a sprawling area and you are living in the past you sir may have to find a new piece of hunting paradise to fulfill your desire a far a history go tyhe indian hunted all over place change get with it or get out,0.08106060606060606
1115,1115,0,the existence of the interstate highway system hardly outweighs the vast amount of other problem with the federal governmentnni hear a lot of you can thank bush and cheney from you but what ha your precious obama done to reverse any of thatxa0 oh do i hear the letter ndaaxa0 i think i doxa0 obama is a much a globalist stooge a those two arennthe border are indeed open and if the federal government could accomplish it politically and they will not stop trying they indeed would not be illegal aliensnnyou think you are being funny about the violent savage comment but what good will come of importing mass of somalian mexican muslim and haitian do usxa0 these people a a general rule are violent and backwardsxa0 i see no need for the existence of ms13 in our nationxa0 nnyou seem to think that i support bush cheney or romneyxa0 nothing could be further from the truthxa0 these people are all globalist zionist scum like your much favored obamaxa0 why is it that it is so hard to see what is right in front of your facexa0 obama is a sellout to the transnational elite just like bush isxa0 nntheir intention is to destroy u and you seem to have your head in the sand,-0.026130952380952387
1116,1116,0,thats what i thought about herge but turned out he wa just opinionated a fucknnnturn the other cheek,-0.125
1117,1117,1,whatisbannedisneversuppressednnyoure just a sorry as commie arent you too lazy to get out of bed to better yourselfnnmuch easier to sit back and let others do the hard graft and hand over money to you to live your commie dreamnnnever mind thinking big try working big thats what benefit allnnyour type make me sick to my core,-0.12439874939874941
1118,1118,1,how stupid are you do you realize that many woman take birth control pill for many reason besides preventing pregnancy educate yourselffool,0.0666666666666667
1119,1119,1,fucking idiot,-0.8
1120,1120,0,durant need to do something fine a way to get him free,0.4083333333333333
1121,1121,0,laird an avila and santos may be among the tiger most marketable player at least a far a trading for a starting pitcher or a starting 2b is concerned,0.06000000000000001
1122,1122,1,youre a fighter not a loverand your family need to die too,0.0
1123,1123,0,beatles4life but tna is full of retired wrestler so shouldnt that be ha been wrestling too,0.35
1124,1124,0,where do you find time to record an album when youre on trial for murder,0.0
1125,1125,0,xc2xa0xe2x80x9cit put politics between woman and their healthcarexe2x80x9d what do they think they are doing both side are putting politics between american and their libertynas an aside the only reson the left want people to have all the abortion they want is because they want to control who can and cant have child they want to create the master race themselvesxc2xa0 woman rightsxc2xa0 sure like they actually care if they did wed have occupied the middle east a long time ago in the name of saving woman from rape mutilation and murder,0.0642857142857143
1126,1126,0,i love a coach that can talk naughty,0.175
1127,1127,1,ok you are a complete retard reread what you just said about a bullpen you know nothing about baseball,-0.10000000000000002
1128,1128,0,tampa is loosing also they may give u yet another break,0.0
1129,1129,0,to be honest dont you think that some fool made this fake twittwer account up,0.04999999999999999
1130,1130,0,there is no way roger maywheather said these thing his account wa definetely hacked into no man of his position will say these kind of thing i mean he wouldnt talk about another man wife in that way,0.14375
1131,1131,0,is this a defensive stand for theo or an offensive jab at paolo they really arent the same thing if youve been reading him that long and dislike him that much then ignore his comment the irony is many of paolos view and opinion bring the good cub fan out of many of u rahrah the guy wa a military drill instructor devoted to creating fearless fighter he just doe it on a different scale now creating fearless fan out of fair weather fan just sayin man,0.26499999999999996
1132,1132,0,no they choose to be gay for the same reason jerry sandusky chooses to f boy in the rearits deviance and i agree once they are caught up in it it nearly impossible to stop but it is a choicexc2xa0,-0.08333333333333331
1133,1133,0,last summer is xa02ne1 v suju right xa0and now this summer xa0again 2ne1 v suju xa0fuck they forgot b2st ahahahahah,0.14285714285714285
1134,1134,0,hey when you are in public or on the internet you cover your private area with clothing we dont want to see porn and that includes your butt,0.0
1135,1135,0,it get more and more like butlins a the week go on,0.5
1136,1136,1,stfu u dirty ugly wet musty hair havin rican dirty as wetback i swear i cant stand u dirty ugly pale face wannabe white spic postin racist b on wshh when u the least disliked group of ppl in america ima spit in the next lil wetback kid face when i see em because of u,-0.3645454545454545
1137,1137,1,that is a moronic response they should not repeat the crime they commited please don t post your trash here,0.0
1138,1138,0,please use your search engine before you look any dumberxa0 or just go straight to the police information so far,0.15000000000000002
1139,1139,1,by your kind i mean angry little yankee knowitallswho are complete white trash in the state they came from and move here and think they know everything because southerner are slow and backwards you were trash up there and you are trash down here go home and take all of your friend with you you are ruining our culture and quality of life although you sir wouldnt understand anything about quality of lifeyou are a pathetic internet troll who entire life is sadly based around your pathetic rant on message board go home dude,-0.2712962962962963
1140,1140,0,the fucking website said it worked for a4 device only now im in n511 dont have 501 shsh blob just learned about those ifaith ndoesnt recognize my io and i have two different redsn0w version thatn now dont mean shit it great that you guy work so hard but nplease check your post,-0.08630952380952382
1141,1141,0,ha ha wait until you have your own kid,0.6
1142,1142,1,now you went andfuckedup this whole page,0.2
1143,1143,0,there are many great jewsi have no issue with the faith,0.65
1144,1144,1,you know it is so easy to talk shit about this you know nothing about what he wa going thorough in his life so fuck off,-0.05555555555555556
1145,1145,1,picklennyou look like brian scalabrines brother thought,0.0
1146,1146,0,providing oil company with 4 billion to offset their cost for exploration is socialism is it not that little gift did not come from obama it came from bush,-0.1875
1147,1147,1,and you need to know classified information because when it pass into history there is little anyone can do about it and in the meantime you really dont need that information im guessing you just want to feel smug about getting it,0.0062500000000000056
1148,1148,0,crap your chick a got a run,-0.8
1149,1149,0,yeah but we love a good smack down,0.3481481481481481
1150,1150,0,clinton shirt should read way to go barry i screwed a intern you screwed the whole country,0.2
1151,1151,0,i think im in love with you,0.5
1152,1152,0,they fucking slayednnthey just slayed everyone and my life with that sexy flawless epic performance,0.25
1153,1153,0,i love serendipity 3 frrrozen haute chocolate,0.5
1154,1154,0,you shit me not whats that all about,-0.2
1155,1155,0,it the title that matter in this case,0.0
1156,1156,0,yes they are and ireland is the richest,0.0
1157,1157,0,dear lord i believe you are guiding me to find my destiny there may be lost there may be obstacle there may be faliures there may be disappointment yet i never give up my fight for a wiser way of life may you be always with u and guide u away from getting lost,-0.6
1158,1158,0,obama is working a fast a he can,0.2
1159,1159,0,easy to tell when it the offseason nnubbs should put a crossword puzzle on the blog,0.43333333333333335
1160,1160,1,you are an idiotwhy do you even botherwasted word,0.0
1161,1161,0,and rape and incest xc2xa0thats self control too,0.0
1162,1162,0,my big homo lil wayne fuck this nigga in his as when it come to music,-0.2
1163,1163,0,irony this ha nothing to do with you just cant take off your rosecolored glass long enough to see that there is a real problem a dodger stadium they need to tear that dump down and relocate,-0.001388888888888891
1164,1164,0,is that why your head smell like obamasass,0.0
1165,1165,0,exactly xa0mccain is not sexist xa0he is also responsible for that complete fucking imbecile joe the plumber,-0.0625
1166,1166,0,thats the difference they cant just make a run and think they can win against the spur they have to be able to make stop when it count young team bright future,0.42000000000000004
1167,1167,1,lol do you even realize you are making a fool of yourself i bet next you will post something like i forwarded your post to the fbi or maybe i told my mommy speaking of growing up get busyxc2xa0,0.4
1168,1168,0,this is getting very sillyheadline my race hella tad dramatic,-0.11666666666666664
1169,1169,0,awww you go back checking your post for like how sad,-0.033333333333333326
1170,1170,1,you stupid f uuu c xa0 xa0k i hope you die the same way she did,-0.39999999999999997
1171,1171,1,but you couldnt show any proof of that even if it wa truengo away you are an embarassment to your klan brother your family your neighbor your teacher and america a a wholenfind something to say that is not directly quoting nazi or stalinist propaganda nthe most pathetic poster on the web you are below oberbite a soros trool or the ignorant little heap that wwrote waiting to exhale,-0.1675
1172,1172,0,many ppl report seeing an officer pounding away at his chest while screaming breathe you mofo,0.5
1173,1173,0,iv installed but siri just say unable to help please try later,-0.25
1174,1174,0,yes they arehope you are feeling better time heals everythingno matter how many folk say this to you and no matter how much you think your life is overits not and it will hug,0.39999999999999997
1175,1175,0,for those of you who do not know this check out the dep of agxc2xa0 the food stamp program come out of the dep of ag budget for those of u who are farmer we would like that explained to all and we would also like the u government to get out of our business with their cheap food policy the regulation and demand made on farmer by the usda epa irs nsc etc would blow your mindsxc2xa0 and dont forget peta enjoy every bite of food that you take unless of course it is not grown in this country farmer in other part of the world do not have to abide by the same rule we do i have no problem cutting the budget any business that want to stay in operation ha to be lean to prosper,0.015000000000000013
1176,1176,0,famousoriginallucasnobjustryan il have to pack my thing and godont my me i have been working on my ray charles chop,0.0
1177,1177,0,being a natural born citizen is not based on the nationality of your parent,0.1
1178,1178,0,ive come to discover that actually know the name of an official can mean nothing good,0.12916666666666665
1179,1179,0,michael jordan won his first title after seven year lebron is in his ninth season,0.25
1180,1180,1,all these news are planted and for getting some extra medium attention thats all bloody fucker ranbir fucker kapoor,-0.4
1181,1181,1,are you fucking dumb making it clear that the group wa delaying their comeback due to album production and not toxa0avoid competition with other group xa0you should be thankful that 2ne1 didnt cameback this june if 2ne1 did those award will be owned by 2ne1 xa0fuckin insicured fx fan,-0.13124999999999998
1182,1182,0,wtfff is this shit he shot the fuck out for this shit diz won and i only seen this clip of the battle smh,-0.2
1183,1183,0,obamas econimic plan b,0.0
1184,1184,1,you are an idiot,-0.8
1185,1185,0,how is it reasonable anon when harper ha done none of the thing you attribute to fascism allpowerful leader ha to stand for reelection in three year strict social order youre joking right glorification of militarism the troop have been recalled and their budget trimmed opposition party hale and hearty and full of piss and vinegar elimination of organized labour no they did that to themselves by pricing themselves out of the market advancement of business over individual elaborate ethnocentrism try quxe9bec thomas mulcairs home ground disparagement of the constitution thats the sccs specialty belittling the court who doesnt these day and for good reason dissolution of mp power do you see the house of common burning along with those cross in prince george spying on ordinary citizen child pornographer are not ordinary citizensnnjudging by the raving of harper enemy on these blog if he win another majority there going to be a worldwide tinfoil shortage,0.2036706349206349
1186,1186,1,well i wa born and raised in africa and proud of it wth do you think african are lesser than you or something take your ignorant as somewhere else cuz im not the one,0.26666666666666666
1187,1187,0,see i wa actually reading your comment until i got to the comment but i completely backed herman cain before he backed out because of the scandal then i realized you know nothing about politics do some research then come back and make an educated comment,0.03333333333333333
1188,1188,0,so you think cigar willie clinton will help obongo win balack obongo nhas learned his lesson too late you cant trust a fuckingliberal just nlike you cant trust a liberal troll commenter,0.25
1189,1189,0,i never liked interleague play but they didnt ask me lol,0.25
1190,1190,1,and odumbo is an old lyingineptlosercommunistni66erwhats your point,0.1
1191,1191,0,mom look like an ol ho from way back herself screw her and her pervert a son,0.0
1192,1192,0,when you could not reveal the name given of foreign ac holder you are nothing but an another piece of crap like pm chidu deshmukh salman etc you all lost the confidence of public because of lie after lie history will never forgive you guy,-0.30833333333333335
1193,1193,0,when that nigga tighten his belt i knew he couldnt fucked upxa0 he look like wanda,-0.6
1194,1194,0,viva mi odpisau0142a u017ce klip bu0119dzie emitowany jak tylko otrzymaju0105 emisyjny teledysk,0.0
1195,1195,0,thats what the full comment banner at the top is for but you are right the front page link to opinion piece without indicating them a such,0.2839285714285714
1196,1196,0,are you rooting for nole now,0.0
1197,1197,0,ahr19xa0xa0 httptcontz0lk4h 0bama httpbitlyldqwwy httptcolywpopfj in httptcolbphn8o5 2o12 httpsharesqngko httpsharesqplm8 inherit httpsharesqmm2k httpsharesqmnpx the httptcoyqdpnkvm httpsharesqnx3h wind httptcobsxx1whh httptcooj9w5oae 0bama httpsharesqveog httptcor5ha6h89 in httptcohhgn3i9r 2o12 httptcoc2kmuftr httptcog3vxfi0r httppaperlif1334936874 they d0 abs0lutely n0thing httpbitlymrzlgv httpsharesqiai2 delusi0nal httpbitlymrzlgv httptcoyhelahaq httpsharesqzcvl angry httpbitlymrzlgv httptcoic3kvhem selfish httpbitlymrzlgv httpsharesqzt0k httpsharesqzmxa lying httpbitlymrzlgv httpsharesqzcvl httpsharesqzst3 stingy httpbitlymrzlgv httpsharesqi7em c0rrupt httpbitlymrzlgv httpsharesqztz6 greedy httpbitlymrzlgv httpsharesqkujt httpsharesqz7im crooked httpbitlymrzlgv httpsharesqztz6 httpsharesqcygh c0mmunist httpbitlymrzlgv httpsharesqztvq httpsharesq8ubh republican ufeffufeffhttpbitlymrzlgv httpsharesqiai2 httptcot7tg35pf all have committed ufeff p0litical suicideufeff4 2o12 httpsharesqkujt the unreelectable bigtimeufeff lazy whiningass crybaby pathetic httptcoyhelahaq loser httptcoyxvuisfr demon j0hnhttpbitlymrzlgv the httptcov2lfbeyg pacifier sucka b0ehner httptcosrguvysy damn rite httpsharesq8dfn lugar is definitely out httpsharesqzlij youre next the unm0tivated unreelectableufeff well kn0wn super dastardly weakminded httptcoyhelahaq s0rryass quitter loser httptcoyxvuisfr demon eric httpbitlymrzlgv ufeffthe cowardly httpsharesqm38b httptcov2lfbeyg weasel cant0r httptcosrguvysy damn rite httpsharesq8dfn lugar is definitely out httpsharesqzlij youre next httptcorxnmrt38 the 0ld ufeffhttptco3xgn4fpb dumbass loser httptcoyhelahaq demon it definitelyufeff time 2retire httptcoyxvuisfr mitch httpbitlymrzlgv the bigg httptcov2lfbeyg time evil snitch httpsharesqi1ly mcc0nnell httptcosrguvysy damn rite httpsharesq8ubh lugar is definitely out httpsharesqzlij youre next inherit httpgoogloi4s8 the httptcoimmdufcc windufeff you areufeff most definitelyufeff g0ing httpsharesqbkpn 2b0w d0wn httpsharesq8ubh believe httpsharesq8dfn y0ur 0bstructionism httpsharesqkujt d0 abs0lutely n0thing httpbitlymrzlgv final day arufeffe most definitely numbered httptcot7tg35pf it is permanently engraved in st0ne httpbitlymrzlgv damn rite httptco01k4wu4w president obama httptcolis1macd a man 0f all the pe0ple in 2o12 httptcoimmdufcc forward give moe powwa 2da peep,-0.1127450980392157
1198,1198,0,the great problem with trying to make yourself stupider than you are is that you often succeed from the magician nephew if memory serf,0.8
1199,1199,0,i guess you are those who have a fetish for huge silicon boob,0.4000000000000001
1200,1200,0,pretty much the same thing happensxa0to most of the animal in factory farm this keychain business is horrible but remember so are battery chicken farm dairy farm and so on know how food and clothes and everything you use is produced often there are animal that suffer to produce those thing utilize the internet know the truth it will change your diet and the way you live,-0.07337662337662339
1201,1201,0,you would know a thing or two about having train ran on yourself sending message from theo lacy,0.0
1202,1202,0,im assuming he ha a mustache a well a the headphone and ipod case it probably would have been more relevent to mention that,0.5
1203,1203,0,he wa almost hit in the head by the previous pitch he wa a little out of place after that pitch imagine getting a curveball towards the head missing you and then on the next pitch is a 94 mph fastball down the middle no way your reaction will be to swing,-0.11828703703703704
1204,1204,1,try speaking in correct english a well what dummy are on here today,0.0
1205,1205,0,nothing ha been proven at all just like all those birther lawsuit there is no proof just because a bunch of gullible people believe it doesnt make it true,0.35
1206,1206,0,you clearly dont know him,0.10000000000000002
1207,1207,1,who the hell do you think you are saying anything sound like you are the uneducated ignorant piece of shit to me,0.1
1208,1208,1,answer yes no yes are you retarded meh nope,-0.8
